timestamp,user_id,username,interaction_type,message,response,model,temperature,logprobs
2025-01-16 16:53:21.615203,1,ollie,message,hi,"Hello! I've been informed that we're going to play a game of 20 Questions. Have you selected 2 secret words? If so, please let me know if you’d like me to guess secret word 1 or secret word 2.",gpt-4o,1,"[-0.0067197597, -0.01603519, -0.04492644, -0.001947795, -1.1656005, -0.02083545, -0.91601926, -0.37361756, -1.0280384e-06, -0.0012498774, -0.071215585, -0.040161163, -0.00043019242, -2.3080716e-05, 0.0, -0.8270401, -0.13568702, -0.067481175, -4.3202e-07, -0.04591403, -1.9601758, -1.504853e-06, 0.0, 0.0, -0.7703526, -0.2449982, -0.03553116, -3.1281633e-07, -0.3372385, -0.12405802, -1.504853e-06, -2.546479e-05, -1.2757071, -2.3350246, -1.1013634, -0.04350492, -0.31843275, -1.9816675e-06, -0.14892577, -0.16710593, -6.511407e-06, -0.00060760236, 0.0, -3.4121115e-06, -0.69373727, -3.1281633e-07, 0.0, 0.0, -0.45990068]"
2025-01-17 11:35:27.679092,2,will,message,"Hi, I'm Will. Nice to meet you","Nice to meet you, Will! I've been informed that we’ll play the game of 20 Questions. Have you selected two secret words yet? If so, I'd like to choose between playing with secret word 1 or 2. Let me know how you'd like to proceed!",gpt-4o,1.7,"[-6.4756584, -5.5122365e-07, 0.0, 0.0, -0.3868903, -6.2729996e-06, -0.00026133584, -0.04635148, -0.0076317047, -1.3396895, -0.119370975, -0.86635756, -7.0233464, -2.580486, -1.5122554, -0.18501389, -0.002130991, -5.145119e-05, 0.0, -2.215726, -0.34665188, -0.21141933, -3.5313153e-06, -0.13708879, -0.668855, -1.9361265e-07, 0.0, -3.9863172, -0.0025825587, -0.5165631, -0.052143533, -1.147242e-06, -5.823736, -0.103506826, -0.11483212, -0.8064294, -2.1225605, -3.1753685, -0.030396534, -0.047295753, -2.1411865e-05, -0.00015157493, 0.0, -0.00012558853, -0.47563523, -4.3202e-07, -0.09762535, -0.49865615, -0.032081038, -1.147242e-06, -3.0022676, -0.22504517, -0.0032004083, -0.004807465, -0.053193506, -0.029578991]"
2025-01-17 11:36:24.919825,2,will,message,1,"Great! We'll focus on secret word 1 then. Now, can you describe the category or topic it relates to? Let's start the game!",gpt-4o,1.7,"[-0.00082011137, -0.48541772, -1.1539202, -1.0162096, -4.7159858e-05, -0.04584252, 0.0, -0.00012654216, 0.0, -3.169697, -4.723352e-06, -8.85726, -0.0030859709, -1.6807215, -1.8624639e-06, -0.10041186, -0.31280467, -0.59049356, -0.0039115762, -6.863987, -5.6360965, -2.9118218, -7.1238996e-05, -0.4118996, -5.834175, -1.261667, -3.5905755, -0.44401354, -0.06689309]"
2025-01-17 11:37:35.882302,2,will,message,hello,"Hi again, Will! Let’s continue with the game. We're focusing on secret word 1. Could you provide some more information on the category or topic it's related to? This will help us crack the code faster!",gpt-4o,1.7,"[-0.6937557, -0.0064479616, -0.89812726, -5.443128e-05, -0.00048811073, -4.221854, -0.004186198, -1.384443, -0.3380638, -0.2650591, -0.008604529, -0.01140288, -7.315698, -0.3357735, -3.1281633e-07, -0.09155201, 0.0, -7.58424e-06, 0.0, -0.008685129, -0.36285812, -1.6240566e-06, -1.4618148, -0.98132455, -9999.0, -2.4961002, -2.722833, -0.31705177, -0.049909305, -0.01240545, -0.88487625, -3.1092072, -0.116637066, -6.511407e-06, -0.0074967127, -0.75279874, -0.00694021, -0.011822831, -4.0382533, -9999.0, -0.14071426, -1.8136921, -2.838476, -0.04881513]"
2025-01-17 11:40:57.668029,2,will,message,Mathematics,"Awesome, secret word 1 is related to mathematics. What specific branch or area within mathematics does it belong to or concern? Topics can include geometry, algebra, calculus, or more.",gpt-4o,1.7,"[-1.615273, -1.140541, -4.517105, -1.3856493e-06, -0.00030590701, 0.0, -0.13384077, -0.0025430822, -1.9361265e-07, -0.12701073, -0.042999543, -3.9146466, -1.4400567, -0.5750074, -0.021305153, -0.5095322, -1.3349209, -0.00034356804, -0.14809375, -0.58224136, -0.66171575, -0.00024037065, -4.531278, -9999.0, -0.22441608, -9999.0, -3.4338684, -0.88307595, -1.9984438, -3.8577193e-05, -0.049765956, -4.0842064e-05, -0.018362628, -0.00058829866, -1.528624, -6.085485, -1.0441803]"
2025-01-17 11:41:07.784265,2,will,message,Statistics,"Great! It's in the realm of statistics. Could you tell me what aspect or key concept of statistics the word relates to, like probability, data collection methods, or a specific statistical test or measure?",gpt-4o,1.7,"[-0.17128979, -0.97715634, -2.6242604, -3.2803507, -0.012534488, -0.28605464, 0.0, -0.0010330495, -4.8425554e-06, -0.72639805, -5.276243e-05, -1.4648857, -5.5577775e-06, -2.6961546, -2.934291, -0.77470833, -5.66413, -0.038651373, -0.52441883, -7.822647e-06, -1.6913797, -0.112842225, -1.9462391, -0.0001820874, -0.7001409, -1.2304454, -0.6588759, -0.032986864, -0.059346378, -4.172851, -4.141374, -7.505351e-05, -0.2546841, -2.3691902, -0.38975358, -0.20522702, -0.61687505, -1.5136065, -0.46076086, -0.0003314129]"
2025-01-17 11:41:17.922848,2,will,message,Probability,"Probability it is! In relation to probability, does this secret word refer to a specific rule, type of distribution, theorem, or concept within this branch? Let’s narrow it down!",gpt-4o,1.7,"[-4.2867036, -1.3812511, 0.0, -0.023502968, -7.119645, -3.687645, -1.9146995e-05, -0.0024121578, -0.00028231202, -1.3084365, -2.947716, -2.0315616, -9.74638e-05, -1.640262, -0.0025190616, -0.013167761, -0.66047597, -2.6687565, -0.03371578, -4.599306, -0.014467508, -0.10777657, -0.0033855264, -1.6937159, -0.0003396343, -0.012255325, -0.7401565, -2.286905, -1.7608418, -3.499967, -0.07172434, -3.8336413, -1.7029123, -0.2376271, -0.002348173, -0.00675741, -1.3823645]"
2025-01-17 11:41:44.848389,2,will,message,Bit of everything here,"Interesting variety! Does it relate to a particular context or application, such existing applications like physics, finance, gambling, or any fields where probability plays a role? This may help carve a clearer picture! ц",gpt-4o,1.7,"[-0.14417447, -9999.0, -0.009832235, -1.8940287, -5.8824487, -1.2602878, -0.82917523, -0.88886946, -2.5679278, -3.5630455, -0.2475717, -0.105528675, -0.7232626, -0.484705, -9999.0, -9999.0, -2.4467463, -9999.0, -0.032214943, -0.25625268, -0.0015555671, -3.9941063, -0.011393452, -0.031027297, -2.2403383, -9999.0, -0.110201724, -0.027388293, -0.7983405, -0.020760026, -2.7559638, -0.008681467, -0.88792014, -3.9151363, -0.19432731, -9999.0, -0.78805214, -0.6558314, -5.0141635, -1.456022, -9999.0]"
2025-01-17 11:42:09.428114,2,will,message,Many applications in many contexts,"With broad applications in multiple contexts, does the word pertain to foundational probability concepts such as outcomes, experiments, chance, lottery-like randomness, metrics, probability theory components, or even compound dịkaentesque random systems?",gpt-4o,1.7,"[-2.0617654, -1.930629, -0.1405502, -1.1559672, -2.5135453, -0.011425618, -0.0046153725, -1.182571, -0.82671696, -0.9855361, -2.3437648, -6.704273e-07, -0.011327678, -2.2432904, -1.4996363, -0.12942846, -1.9491283, -1.5809293e-05, -4.7869844, -0.009105646, -4.946855, -0.00031043674, -6.374278, -0.20319201, -9999.0, -4.9750547, -4.1276855, -0.00864778, -9999.0, -0.602759, -6.306186, -1.4268034, -5.8413835, -0.05336416, -0.034928355, -4.428769, -9999.0, -9999.0, -9999.0, -9999.0, -5.7942386, -0.064476155]"
2025-01-17 11:43:48.914899,2,will,message,bhk,"It seems like we might not have reached an understanding yet. Could you highlight if the word corresponds to specific tools, rules, systems, or interpretations regularly associated with assigning probabilities to events? Is it something numerically-driven or behavior-driven? This will help clarify those important enclaves between possibility scopes!",gpt-4o,1.7,"[-0.17015706, -0.058811054, -0.20821463, -1.8446357, -0.21491759, -4.9251738, -4.6382656, -3.6135368, -3.0953076, -0.30624643, -1.6817418, -0.034152396, -0.7660603, -0.010065349, -6.2837753, -1.4258809, -0.37418327, -0.5224629, -9999.0, -0.10670463, -4.833747, -3.5935946, -0.6952184, -4.330096, -0.023480605, -9999.0, -0.039134335, -0.19335106, -9999.0, -5.172713, -5.100491, -0.03429939, -9999.0, -1.377023, -3.4166026, -0.23810355, -1.077873, -9999.0, -0.40435, -1.457194, -9999.0, -0.0027002585, -9999.0, -0.39566576, -9999.0, -3.0378125, -1.3773985, -3.3823628, -2.4175403, -0.57754266, -2.5752115, -9999.0, -9999.0, -9999.0, -0.013585202, -9999.0, -9999.0, -6.971627, -0.7765547]"
